SPELL NAME,SPELL BASICS,SPELL LEVEL,SCHOOL,RITUAL,CONCENTRATION,COMPONENTS,RANGE,CAST TIME,DURATION,DESCRIPTION,DAMAGE INFO,DAMAGE SPELL ,MELEE SPELL ATTACK,RANGED SPELL ATTACK,ACID,COLD,BLUDGEONING,FIRE,FORCE,LIGHTNING,NECROTIC,PIERCING,POISON,RADIANT,SLASHING,THUNDER,SPELL CATEGORY,AOE,BANISHMENT,BUFF,CONDITIONS,COMMUNICATION,CONCEALMENT,DEBUFF,DEFENSIVE,DIVINATION,HEAL,ILLUSION,ILLUMINATION,MINIONS,MOBILITY,6TH SENSE,OFFENSIVE,OTHER,PLANAR,REALITY WARP,REVIVE/RESTORE,SCALES,TELEPORTATION,WARDING,SAVING THROWS,CHARISMA,CONSTITUTION,DEXTERITY,STRENGTH,WISDOM,CLASS,ARTIFICER,BARD,CLERIC,DRUID,PALADIN,RANGER,SORCERER,WARLOCK,WIZARD
CONJURE CELESTIAL,SPELL BASICS,7,CONJURATION,0,,V.S.@,90 FEET,1 HOUR@ (CONCENTRATION),1 HOUR@ (CONCENTRATION),"YOU SUMMON A CELESTIAL OF CHALLENGE RATING 4 OR LOWER, WHICH APPEARS IN AN UNOCCUPIED SPACE THAT YOU CAN SEE WITHIN RANGE. THE CELESTIAL DISAPPEARS WHEN IT DROPS TO 0 HIT POINTS OR WHEN THE SPELL ENDS.&THE CELESTIAL IS FRIENDLY TO YOU AND YOUR COMPANIONS FOR THE DURATION. ROLL INITIATIVE FOR THE CELESTIAL, WHICH HAS ITS OWN TURNS. IT OBEYS ANY VERBAL COMMANDS THAT YOU ISSUE TO IT (NO ACTION REQUIRED BY YOU), AS LONG AS THEY DON’T VIOLATE ITS ALIGNMENT. IF YOU DON’T ISSUE ANY COMMANDS TO THE CELESTIAL, IT DEFENDS ITSELF FROM HOSTILE CREATURES BUT OTHERWISE TAKES NO ACTIONS.&THE DM HAS THE CELESTIAL’S STATISTICS.&&AT HIGHER LEVELS. WHEN YOU CAST THIS SPELL USING A 9TH-LEVEL SPELL SLOT, YOU SUMMON A CELESTIAL OF CHALLENGE RATING 5 OR LOWER.@",DAMAGE INFO,,,,0,0,0,0,0,0,0,0,0,0,0,0,SPELL CATEGORY,0,,0,0,0,,0,0,0,0,0,0,1,,0,0,0,,0,0,0,0,,SAVING THROWS,,,,,,CLASS,0,0,1,0,0,0,0,0,0
CONJURE ELEMENTAL,SPELL BASICS,5,CONJURATION,0,,"V.S.M.(BURNING INCENSE FOR AIR, SOFT CLAY FOR EARTH, SULEFER AND POHOSPHEOUS FOR FIRE, WATER & SAND FOR WATER)@",1 MINUTE@,1 HOUR@ (CONCENTRATION),1 HOUR@ (CONCENTRATION),"YOU CALL FORTH AN ELEMENTAL SERVANT. CHOOSE AN AREA OF AIR, EARTH, FIRE, OR WATER THAT FILLS A 10-FOOT CUBE WITHIN RANGE. AN ELEMENTAL OF CHALLENGE RATING 5 OR LOWER APPROPRIATE TO THE AREA YOU CHOSE APPEARS IN AN UNOCCUPIED SPACE WITHIN 10 FEET OF IT. FOR EXAMPLE, A FIRE ELEMENTAL EMERGES FROM A BONFIRE, AND AN EARTH ELEMENTAL RISES UP FROM THE GROUND. THE ELEMENTAL DISAPPEARS WHEN IT DROPS TO 0 HIT POINTS OR WHEN THE SPELL ENDS.&THE ELEMENTAL IS FRIENDLY TO YOU AND YOUR COMPANIONS FOR THE DURATION. ROLL INITIATIVE FOR THE ELEMENTAL, WHICH HAS ITS OWN TURNS. IT OBEYS ANY VERBAL COMMANDS THAT YOU ISSUE TO IT (NO ACTION REQUIRED BY YOU). IF YOU DON’T ISSUE ANY COMMANDS TO THE ELEMENTAL, IT DEFENDS ITSELF FROM HOSTILE CREATURES BUT OTHERWISE TAKES NO ACTIONS.&IF YOUR CONCENTRATION IS BROKEN, THE ELEMENTAL DOESN’T DISAPPEAR. INSTEAD, YOU LOSE CONTROL OF THE ELEMENTAL, IT BECOMES HOSTILE TOWARD YOU AND YOUR COMPANIONS, AND IT MIGHT ATTACK. AN UNCONTROLLED ELEMENTAL CAN’T BE DISMISSED BY YOU, AND IT DISAPPEARS 1 HOUR@ AFTER YOU SUMMONED IT. &THE DM HAS THE ELEMENTAL’S STATISTICS.&&AT HIGHER LEVELS. WHEN YOU CAST THIS SPELL USING A SPELL SLOT OF 6TH LEVEL OR HIGHER, THE CHALLENGE RATING INCREASES BY 1 FOR EACH SLOT LEVEL ABOVE 5TH.@",DAMAGE INFO,,,,0,0,0,0,0,0,0,0,0,0,0,0,SPELL CATEGORY,0,,0,0,0,,0,0,0,0,0,0,1,,0,0,0,,0,0,1,0,,SAVING THROWS,,,,,,CLASS,0,0,0,1,0,0,0,0,1
CONJURE FEY,SPELL BASICS,6,CONJURATION,0,,V.S.@,90 FEET,1 MINUTE@,1 HOUR@ (CONCENTRATION),"YOU SUMMON A FEY CREATURE OF CHALLENGE RATING 6 OR LOWER, OR A FEY SPIRIT THAT TAKES THE FORM OF A BEAST OF CHALLENGE RATING 6 OR LOWER. IT APPEARS IN AN UNOCCUPIED SPACE THAT YOU CAN SEE WITHIN RANGE. THE FEY CREATURE DISAPPEARS WHEN IT DROPS TO 0 HIT POINTS OR WHEN THE SPELL ENDS.&THE FEY CREATURE IS FRIENDLY TO YOU AND YOUR COMPANIONS FOR THE DURATION. ROLL INITIATIVE FOR THE CREATURE, WHICH HAS ITS OWN TURNS. IT OBEYS ANY VERBAL COMMANDS THAT YOU ISSUE TO IT (NO ACTION REQUIRED BY YOU), AS LONG AS THEY DON’T VIOLATE ITS ALIGNMENT. IF YOU DON’T ISSUE ANY COMMANDS TO THE FEY CREATURE, IT DEFENDS ITSELF FROM HOSTILE CREATURES BUT OTHERWISE TAKES NO ACTIONS.&IF YOUR CONCENTRATION IS BROKEN, THE FEY CREATURE DOESN’T DISAPPEAR. INSTEAD, YOU LOSE CONTROL OF THE FEY CREATURE, IT BECOM ES HOSTILE TOWARD YOU AND YOUR COMPANIONS, AND IT MIGHT ATTACK. AN UNCONTROLLED FEY CREATURE CAN’T BE DISMISSED BY YOU, AND IT DISAPPEARS 1 HOUR@ AFTER YOU SUMMONED IT.&THE DM HAS THE FEY CREATURE’S STATISTICS.&&AT HIGHER LEVELS. WHEN YOU CAST THIS SPELL USING A SPELL SLOT OF 7TH LEVEL OR HIGHER, THE CHALLENGE RATING INCREASES BY 1 FOR EACH SLOT LEVEL ABOVE 6TH.@",DAMAGE INFO,,,,0,0,0,0,0,0,0,0,0,0,0,0,SPELL CATEGORY,0,,0,0,0,,0,0,0,0,0,0,1,,0,0,0,,0,0,0,0,,SAVING THROWS,,,,,,CLASS,0,0,0,1,0,0,0,1,0
*CONJURE KNOWBOT,SPELL BASICS,4,CONJURATION,0,,V.S.@,TOUCH,1 ACTION,10 MINUTES,"YOU TOUCH A SINGLE COMPUTERIZED DEVICE OR COMPUTER SYSTEM TO CONJUR A KNOWBOT - A PARTIALLY SENTIENT PIECE OF SOFTWARE IMPRINTED WITH VESTIGES OF YOUR OWN SKILLS AND COMPUTER ABILITIES. FOR THE DURATION OF THE SPELL, YOU CAN USE A BONUS ACTION TO HAVE THE KNOWBOT EXECUTE A COMPUTER-RELATED TASK THAT WOULD NORMALLY REQUIRE AN ACTION. THE KNOWBOT MAKES INTELLIGENCE ABILITY CHECKS USING YOUR ABILITY SCORE AND PROFICIENCY BONUS (INCLUDING YOUR PROFICIENCY WITH HACKING TOOLS, IF APPLICABLE).&YOU HAVE A LIMITED TELEPATHIC BOND WITH THE KNOWBOT, OUT TO A RANGE OF 500 FEET FROM THE DEVICE OR SYSTEM WHERE THE KNOWBOT WAS CONJURED. IF YOU MOVE BEYOND THIS RANGE, THE KNOWBOT DISAPPEARS IN 2D4 ROUNDS, AS IF THE DURATION OF THE SPELL HAD EXPIRED. MOVING WITHIN RANGE AGAIN IMMEDIATELY RE-ESTABLISHES THE BOND.&THE KNOWBOT IS BOUND TO THE SYSTEM IN WHICH IT WAS CREATED, AND IT STAYS THERE UNTIL IT IS DISMISSED OR THE SPELLS DURATION EXPIRES.&&AT HIGHER LEVELS. WHEN YOU CAST THIS SPELL USING A SPELL SLOT OF 5TH LEVEL OR HIGHER, THE SPELLS DURATION INCREASES TO 1 HOUR@. ADDITIONALLY, YOUR TELEPATHIC BOND WITH THE KNOWBOT IS EFFECTIVE OUT TO A RANGE OF 1000 FEET AND IF YOU LEAVE THE RANGE OF THE BOND, THE KNOWBOT CONTINUES PERFORMING ITS LAST DIRECTED TASK UNTIL THE SPELL EXPIRES.@",DAMAGE INFO,,,,0,0,0,0,0,0,0,0,0,0,0,0,SPELL CATEGORY,0,,0,0,0,,0,0,0,0,0,0,1,,0,0,0,,0,0,0,0,,SAVING THROWS,,,,,,CLASS,0,0,0,0,0,0,1,1,1
CONJURE MINOR ELEMENTALS,SPELL BASICS,4,CONJURATION,0,,V.S.@,90 FEET,1 MINUTE@,1 HOUR@ (CONCENTRATION),"YOU SUMMON ELEMENTALS THAT APPEAR IN UNOCCUPIED SPACES THAT YOU CAN SEE WITHIN RANGE. YOU CHOOSE ONE OF THE FOLLOWING OPTIONS FOR WHAT APPEARS:&$*ONE ELEMENTAL OF CHALLENGE RATING 2 OR LOWER&$*TWO ELEMENTALS OF CHALLENGE RATING 1 OR LOWER&$*FOUR ELEMENTALS OF CHALLENGE RATING 1/2 OR LOWER&$*EIGHT ELEMENTALS OF CHALLENGE RATING 1/4 OR LOWER.&$*AN ELEMENTAL SUMMONED BY THIS SPELL DISAPPEARS WHEN IT DROPS TO 0 HIT POINTS OR WHEN THE SPELL ENDS. &$*THE SUMMONED CREATURES ARE FRIENDLY TO YOU AND YOUR COMPANIONS. ROLL INITIATIVE FOR THE SUMMONED CREATURES AS A GROUP, WHICH HAS ITS OWN TURNS. THEY OBEY ANY VERBAL COMMANDS THAT YOU ISSUE TO THEM (NO ACTION REQUIRED BY YOU). IF YOU DON’T ISSUE ANY COMMANDS TO THEM, THEY DEFEND THEMSELVES FROM HOSTILE CREATURES, BUT OTHERWISE TAKE NO ACTIONS&THE DM HAS THE CREATURES’ STATISTICS.&&AT HIGHER LEVELS. WHEN YOU CAST THIS SPELL USING CERTAIN HIGHER-LEVEL SLOTS, YOU CHOOSE ONE OF THE SUMMONING OPTIONS ABOVE, AND MORE CREATURES APPEAR: TWICE AS MANY WITH A 6TH-LEVEL SLOT AND THREE TIMES AS MANY WITH AN 8TH-LEVEL SLOT.",DAMAGE INFO,,,,0,0,0,0,0,0,0,0,0,0,0,0,SPELL CATEGORY,0,,0,0,0,,0,0,0,0,0,0,1,,0,0,0,,0,0,0,0,,SAVING THROWS,,,,,,CLASS,0,0,0,1,0,0,0,0,1
CONJURE VOLLEY,SPELL BASICS,4,CONJURATION,0,,V.S.M. (ONE PIECE OF AMMUNITION OR ONE THROWING WEAPON)@,150 FEET,1 ACTION,INSTANTANEOUS@,"YOU FIRE A PIECE OF NONMAGICAL AMMUNITION FROM A RANGED WEAPON OR THROW A NONMAGICAL WEAPON INTO THE AIR AND CHOOSE A POINT WITHIN RANGE. HUNDREDS OF DUPLICATES OF THE AMMUNITION OR WEAPON FALL IN A VOLLEY FROM ABOVE AND THEN DISAPPEAR. EACH CREATURE IN A 40-FOOT-RADIUS, 20-FOOT-HIGH CYLINDER CENTERED ON THAT POINT MUST MAKE A DEXTERITY SAVING THROW. A CREATURE TAKES 8D8 DAMAGE ON A FAILED SAVE, OR HALF AS MUCH DAMAGE ON A SUCCESSFUL ONE. THE DAMAGE TYPE IS THE SAME AS THAT OF THE AMMUNITION OR WEAPON.@",DAMAGE INFO,,,,0,0,1,0,0,0,0,1,0,0,1,0,SPELL CATEGORY,1,,0,0,0,,0,0,0,0,0,0,0,,0,1,0,,0,0,0,0,,SAVING THROWS,,,,,,CLASS,0,0,0,0,0,1,0,0,0
CONJURE WOODLAND BEINGS,SPELL BASICS,4,CONJURATION,0,,V.S.M. (ONE HOLLY BERRY PER CREATURE SUMMONED)@,60 FEET,1 ACTION,1 HOUR@ (CONCENTRATION),"YOU SUMMON FEY CREATURES THAT APPEAR IN UNOCCUPIED SPACES THAT YOU CAN SEE WITHIN RANGE. CHOOSE ONE OF THE FOLLOWING OPTIONS FOR WHAT APPEARS:&$*ONE FEY CREATURE OF CHALLENGE RATING 2 OR LOWER&$*TWO FEY CREATURES OF CHALLENGE RATING 1 OR LOWER&$*FOUR FEY CREATURES OF CHALLENGE RATING 1/2 OR LOWER&$*EIGHT FEY CREATURES OF CHALLENGE RATING 1/4 OR LOWER&A SUMMONED CREATURE DISAPPEARS WHEN IT DROPS TO 0 HIT POINTS OR WHEN THE SPELL ENDS.&THE SUMMONED CREATURES ARE FRIENDLY TO YOU AND YOUR COMPANIONS. ROLL INITIATIVE FOR THE SUMMONED CREATURES AS A GROUP, WHICH HAVE THEIR OWN TURNS. THEY OBEY ANY VERBAL COMMANDS THAT YOU ISSUE TO THEM (NO ACTION REQUIRED BY YOU). IF YOU DON’T ISSUE ANY COMMANDS TO THEM, THEY DEFEND THEMSELVES FROM HOSTILE CREATURES, BUT OTHERWISE TAKE NO ACTIONS.&THE DM HAS THE CREATURES’ STATISTICS.&&AT HIGHER LEVELS. WHEN YOU CAST THIS SPELL USING CERTAIN HIGHER-LEVEL SPELL SLOTS, YOU CHOOSE ONE OF THE SUMMONING OPTIONS ABOVE, AND MORE CREATURES APPEAR: TWICE AS MANY WITH A 6TH-LEVEL SLOT AND THREE TIMES AS MANY WITH AN 8TH-LEVEL SLOT.@",DAMAGE INFO,,,,0,0,0,0,0,0,0,0,0,0,0,0,SPELL CATEGORY,0,,0,0,0,,0,0,0,0,0,0,1,,0,0,0,,0,0,1,0,,SAVING THROWS,,,,,,CLASS,0,0,0,1,0,1,0,0,0
CONTACT OTHER PLANE,SPELL BASICS,5,DIVINATION,1,,V.@,SELF,1 MINUTE@,1 MINUTE@,"YOU MENTALLY CONTACT A DEMIGOD, THE SPIRIT OF A LONG-DEAD SAGE, OR SOME OTHER MYSTERIOUS ENTITY FROM ANOTHER PLANE. CONTACTING THIS EXTRAPLANAR INTELLIGENCE CAN STRAIN OR EVEN BREAK YOUR MIND. WHEN YOU CAST THIS SPELL, MAKE A DC 15 INTELLIGENCE SAVING THROW. ON A FAILURE, YOU TAKE 6D6 PSYCHIC DAMAGE AND ARE INSANE UNTIL YOU FINISH A LONG REST. WHILE INSANE, YOU CAN’T TAKE ACTIONS, CAN’T UNDERSTAND WHAT OTHER CREATURES SAY, CAN’T READ, AND SPEAK ONLY IN GIBBERISH. A GREATER RESTORATION SPELL CAST ON YOU ENDS THIS EFFECT.&ON A SUCCESSFUL SAVE, YOU CAN ASK THE ENTITY UP TO FIVE QUESTIONS. YOU MUST ASK YOUR QUESTIONS BEFORE THE SPELL ENDS. THE DM ANSWERS EACH QUESTION WITH ONE WORD, SUCH AS “YES,” “NO,” “MAYBE,” “NEVER,” “IRRELEVANT,” OR “UNCLEAR” (IF THE ENTITY DOESN’T KNOW THE ANSWER TO THE QUESTION). IF A ONE-WORD ANSWER WOULD BE MISLEADING, THE DM MIGHT INSTEAD OFFER A SHORT PHRASE AS AN ANSWER.@",DAMAGE INFO,,,,0,0,0,0,0,0,0,0,0,0,0,0,SPELL CATEGORY,0,,0,0,0,,0,0,1,0,0,0,0,,0,0,0,,0,0,0,0,,SAVING THROWS,,,,,,CLASS,0,0,0,0,0,0,0,1,1
CONTAGION,SPELL BASICS,5,NECROMANCY,0,,V.S.@,TOUCH,1 ACTION,7 DAYS,"YOUR TOUCH INFLICTS DISEASE. MAKE A MELEE SPELL ATTACK AGAINST A CREATURE WITHIN YOUR REACH. ON A HIT, YOU AFFLICT THE CREATURE WITH A DISEASE OF YOUR CHOICE FROM ANY OF THE ONES DESCRIBED BELOW. AT THE END OF EACH OF THE TARGET’S TURNS, IT MUST MAKE A CONSTITUTION SAVING THROW. AFTER FAILING THREE OF THESE SAVING THROWS, THE DISEASE’S EFFECTS LAST FOR THE DURATION, AND THE CREATURE STOPS MAKING THESE SAVES. AFTER SUCCEEDING ON THREE OF THESE SAVING THROWS, THE CREATURE RECOVERS FROM THE DISEASE, AND THE SPELL ENDS. SINCE THIS SPELL INDUCES A NATURAL DISEASE IN ITS TARGET, ANY EFFECT THAT REMOVES A DISEASE OR OTHERWISE AMELIORATES A DISEASE’S EFFECTS APPLY TO IT.&$*BLINDING SICKNESS. PAIN GRIPS THE CREATURE’S MIND, AND ITS EYES TURN MILKY WHITE. THE CREATURE HAS DISADVANTAGE ON WISDOM CHECKS AND WISDOM SAVING THROWS AND IS BLINDED.&$*FILTH FEVER. A RAGING FEVER SWEEPS THROUGH THE CREATURE’S BODY. THE CREATURE HAS DISADVANTAGE ON STRENGTH CHECKS, STRENGTH SAVING THROWS, AND ATTACK ROLLS THAT USE STRENGTH.&$*FLESH ROT. THE CREATURE’S FLESH DECAYS. THE CREATURE HAS DISADVANTAGE ON CHARISMA CHECKS AND VULNERABILITY TO ALL DAMAGE. .&$*MINDFIRE. THE CREATURE’S MIND BECOMES FEVERISH. THE CREATURE HAS DISADVANTAGE ON INTELLIGENCE CHECKS AND INTELLIGENCE SAVING THROWS, AND THE CREATURE BEHAVES AS IF UNDER THE EFFECTS OF THE CONFUSION SPELL DURING COMBAT. .&$*SEIZURE. THE CREATURE IS OVERCOME WITH SHAKING. THE CREATURE HAS DISADVANTAGE ON DEXTERITY CHECKS, DEXTERITY SAVING THROWS, AND ATTACK ROLLS THAT USE DEXTERITY.SLIMY DOOM. .&$*THE CREATURE BEGINS TO BLEED UNCONTROLLABLY. THE CREATURE HAS DISADVANTAGE ON CONSTITUTION CHECKS AND CONSTITUTION SAVING THROWS. IN ADDITION, WHENEVER THE CREATURE TAKES DAMAGE, IT IS STUNNED UNTIL THE END OF ITS NEXT TURN.@",DAMAGE INFO,,,,0,0,0,0,0,0,0,0,0,0,0,0,SPELL CATEGORY,0,,0,1,0,,1,0,0,0,0,0,0,,0,0,0,,0,0,0,0,,SAVING THROWS,,,,,,CLASS,0,0,1,1,0,0,0,0,0
CONTINGENCY,SPELL BASICS,6,EVOCATION,0,,V.S.M. (A STATUETTE OF YOURSELF CARVED FROM IVORY AND DECORATED WITH GEMS WORTH AT LEAST 1500 GP)@,SELF,10 MINUTES,10 DAYS,"CHOOSE A SPELL OF 5TH LEVEL OR LOWER THAT YOU CAN CAST, THAT HAS A CASTING TIME OF 1 ACTION, AND THAT CAN TARGET YOU. YOU CAST THAT SPELL–CALLED THE CONTINGENT SPELL–AS PART OF CASTING CONTINGENCY, EXPENDING SPELL SLOTS FOR BOTH, BUT THE CONTINGENT SPELL DOESN’T COME INTO EFFECT. INSTEAD, IT TAKES EFFECT WHEN A CERTAIN CIRCUMSTANCE OCCURS. YOU DESCRIBE THAT CIRCUMSTANCE WHEN YOU CAST THE TWO SPELLS. FOR EXAMPLE, A CONTINGENCY CAST WITH WATER BREATHING MIGHT STIPULATE THAT WATER BREATHING COMES INTO EFFECT WHEN YOU ARE ENGULFED IN WATER OR A SIMILAR LIQUID.&THE CONTINGENT SPELL TAKES EFFECT IMMEDIATELY AFTER THE CIRCUMSTANCE IS MET FOR THE FIRST TIME, WHETHER OR NOT YOU WANT IT TO. AND THEN CONTINGENCY ENDS.&THE CONTINGENT SPELL TAKES EFFECT ONLY ON YOU, EVEN IF IT CAN NORMALLY TARGET OTHERS. YOU CAN USE ONLY ONE CONTINGENCY SPELL AT A TIME. IF YOU CAST THIS SPELL AGAIN, THE EFFECT OF ANOTHER CONTINGENCY SPELL ON YOU ENDS. ALSO, CONTINGENCY ENDS ON YOU IF ITS MATERIAL COMPONENT IS EVER NOT ON YOUR PERSON.@",DAMAGE INFO,,,,0,0,0,0,0,0,0,0,0,0,0,0,SPELL CATEGORY,0,,0,0,0,,0,0,0,0,0,0,0,,0,0,1,,0,0,0,0,,SAVING THROWS,,,,,,CLASS,0,0,0,0,0,0,0,0,1
CONTINUAL FLAME,SPELL BASICS,2,EVOCATION,0,,"V.S.M. (RUBY DUST WORTH 50GP, WHICH THE SPELL CONSUMES)@",SELF,1 ACTION,UNTIL DISPELLED,,DAMAGE INFO,,,,0,0,0,0,0,0,0,0,0,0,0,0,SPELL CATEGORY,0,,0,0,0,,0,0,0,0,0,1,0,,0,0,0,,0,0,0,0,,SAVING THROWS,,,,,,CLASS,0,0,1,0,0,0,0,0,1
*CONTROL FLAMES,SPELL BASICS,0,TRANSMUTATION,0,,S. @,60 FEET,1 ACTION,INSTANTANEOUS@ OR 1 HOUR@,"YOU CHOOSE NONMAGICAL FLAME THAT YOU CAN SEE WITHIN RANGE AND THAT FITS WITHIN A 5-FOOT CUBE. YOU AFFECT IT IN ONE OF THE FOLLOWING WAYS:&*$YOU INSTANTANEOUS@LY EXPAND THE FLAME 5 FEET IN ONE DIRECTION, PROVIDED THAT WOOD OR OTHER FUEL IS PRESENT IN THE NEW LOCATION.&*$YOU INSTANTANEOUS@LY EXTINGUISH THE FLAMES WITHIN THE CUBE.&*$YOU DOUBLE OR HALVE THE AREA OF BRIGHT LIGHT AND DIM LIGHT CAST BY THE FLAME, CHANGE ITS COLOR, OR BOTH. THE CHANGE LASTS FOR 1 HOUR@.&*$YOU CAUSE SIMPLE SHAPES—SUCH AS THE VAGUE FORM OF A CREATURE, AN INANIMATE OBJECT, OR A LOCATION—TO APPEAR WITHIN THE FLAMES AND ANIMATE AS YOU LIKE. THE SHAPES LAST FOR 1 HOUR@.&IF YOU CAST THIS SPELL MULTIPLE TIMES, YOU CAN HAVE UP TO THREE OF ITS NON-INSTANTANEOUS@ EFFECTS ACTIVE AT A TIME, AND YOU CAN DISMISS SUCH AN EFFECT AS AN ACTION.@",DAMAGE INFO,,,,0,0,0,1,0,0,0,0,0,0,0,0,SPELL CATEGORY,1,,0,0,0,,0,0,0,0,0,1,0,,0,0,0,,1,0,0,0,,SAVING THROWS,,,,,,CLASS,0,0,0,1,0,0,1,0,1
CONTROL WATER,SPELL BASICS,,,,,,,,,,DAMAGE INFO,,,,,,,,,,,,,,,,SPELL CATEGORY,,,,,,,,,,,,,,,,,,,,,,,,SAVING THROWS,,,,,,CLASS,,,,,,,,,
CONTROL WEATHER,SPELL BASICS,,,,,,,,,,DAMAGE INFO,,,,,,,,,,,,,,,,SPELL CATEGORY,,,,,,,,,,,,,,,,,,,,,,,,SAVING THROWS,,,,,,CLASS,,,,,,,,,
*CONTROL WINDS,SPELL BASICS,,,,,,,,,,DAMAGE INFO,,,,,,,,,,,,,,,,SPELL CATEGORY,,,,,,,,,,,,,,,,,,,,,,,,SAVING THROWS,,,,,,CLASS,,,,,,,,,
CORDON OF ARROWS,SPELL BASICS,,,,,,,,,,DAMAGE INFO,,,,,,,,,,,,,,,,SPELL CATEGORY,,,,,,,,,,,,,,,,,,,,,,,,SAVING THROWS,,,,,,CLASS,,,,,,,,,
COUNTERSPELL,SPELL BASICS,,,,,,,,,,DAMAGE INFO,,,,,,,,,,,,,,,,SPELL CATEGORY,,,,,,,,,,,,,,,,,,,,,,,,SAVING THROWS,,,,,,CLASS,,,,,,,,,
*CREATE BONFIRE,SPELL BASICS,0,CONJURATION,0,,V.S.@,60 FEET,1 ACTION,"CONCENTRATION, UP TO 1 MINUTE@","YOU CREATE A BONFIRE ON GROUND THAT YOU CAN SEE WITHIN RANGE. UNTIL THE SPELLS ENDS, THE BONFIRE FILLS A 5-FOOT CUBE. ANY CREATURE IN THE BONFIRE’S SPACE WHEN YOU CAST THE SPELL MUST SUCCEED ON A DEXTERITY SAVING THROW OR TAKE 1D8 FIRE DAMAGE. A CREATURE MUST ALSO MAKE THE SAVING THROW WHEN IT ENTERS THE BONFIRE’S SPACE FOR THE FIRST TIME ON A TURN OR ENDS ITS TURN THERE.&&AT HIGHER LEVELS. THE SPELL’S DAMAGE INCREASES BY 1D8 WHEN YOU REACH 5TH LEVEL (2D8), 11TH LEVEL (3D8), AND 17TH LEVEL (4D8).@",DAMAGE INFO,,,,,,,,,,,,,,,,SPELL CATEGORY,,,6,,,,,,,,,,,,,,,,,,,,,SAVING THROWS,,,,,,CLASS,0,0,0,1,0,0,1,1,1
CREATE FOOD AND WATER,SPELL BASICS,,,,,,,,,,DAMAGE INFO,,,,,,,,,,,,,,,,SPELL CATEGORY,,,,,,,,,,,,,,,,,,,,,,,,SAVING THROWS,,,,,,CLASS,,,,,,,,,
CREATE OR DESTROY WATER,SPELL BASICS,1,TRANSMUTATION,1,,V.S.M. (A DROP OF WATER IF CREATING OR A FEW GRAINS OF SAND IF DESTROYING)@,30 FEET,1 ACTION,INSTANTANEOUS@,"YOU EITHER CREATE OR DESTROY WATER.&*$CREATE WATER. YOU CREATE UP TO 10 GALLONS OF CLEAN WATER WITHIN RANGE IN AN OPEN CONTAINER. ALTERNATIVELY, THE WATER FALLS AS RAIN IN A 30-FOOT CUBE WITHIN RANGE, EXTINGUISHING EXPOSED FLAMES IN THE AREA. &*$DESTROY WATER. YOU DESTROY UP TO 10 GALLONS OF WATER IN AN OPEN CONTAINER WITHIN RANGE. ALTERNATIVELY, YOU DESTROY FOG IN A 30-FOOT CUBE WITHIN RANGE.&&AT HIGHER LEVELS. WHEN YOU CAST THIS SPELL USING A SPELL SLOT OF 2ND LEVEL OR HIGHER, YOU CREATE OR DESTROY 10 ADDITIONAL GALLONS OF WATER, OR THE SIZE OF THE CUBE INCREASES BY 5 FEET, FOR EACH SLOT LEVEL ABOVE 1ST.@",DAMAGE INFO,,,,,,,,,,,,,,,,SPELL CATEGORY,,,6,,,,,,,,,,,,,,,,,,,,,SAVING THROWS,,,,,,CLASS,0,0,1,1,0,0,0,0,0
CREATE UNDEAD,SPELL BASICS,,,,,,,,,,DAMAGE INFO,,,,,,,,,,,,,,,,SPELL CATEGORY,,,,,,,,,,,,,,,,,,,,,,,,SAVING THROWS,,,,,,CLASS,,,,,,,,,
CREATION,SPELL BASICS,,,,,,,,,,DAMAGE INFO,,,,,,,,,,,,,,,,SPELL CATEGORY,,,,,,,,,,,,,,,,,,,,,,,,SAVING THROWS,,,,,,CLASS,,,,,,,,,
CROWN OF MADNESS,SPELL BASICS,,,,,,,,,,DAMAGE INFO,,,,,,,,,,,,,,,,SPELL CATEGORY,,,,,,,,,,,,,,,,,,,,,,,,SAVING THROWS,,,,,,CLASS,,,,,,,,,
CRUSADERS MANTLE,SPELL BASICS,,,,,,,,,,DAMAGE INFO,,,,,,,,,,,,,,,,SPELL CATEGORY,,,,,,,,,,,,,,,,,,,,,,,,SAVING THROWS,,,,,,CLASS,,,,,,,,,
CURE WOUNDS,SPELL BASICS,1,EVOCATION,0,,V.S.@,TOUCH,1 ACTION,INSTANTANEOUS@,"A CREATURE YOU TOUCH REGAINS A NUMBER OF HIT POINTS EQUAL TO 1D8 + YOUR SPELLCASTING ABILITY MODIFIER. THIS SPELL HAS NO EFFECT ON UNDEAD OR CONSTRUCTS.&&AT HIGHER LEVELS. WHEN YOU CAST THIS SPELL USING A SPELL SLOT OF 2ND LEVEL OR HIGHER, THE HEALING INCREASES BY 1D8 FOR EACH SLOT LEVEL ABOVE 1ST.@",DAMAGE INFO,,,,,,,,,,,,,,,,SPELL CATEGORY,,,5,,,,,,,,,,,,,,,,,,,,,SAVING THROWS,,,,,,CLASS,1,1,1,1,1,1,0,0,0
DANCING LIGHTS,SPELL BASICS,0,EVOCATION,0,,V.S.M. (A BIT OF PHOSPHORUS WYCHWOOD OR A GLOWWORM)@,120 FEET,1 ACTION,"CONCENTRATION, UP TO 1 MINUTE@","YOU CREATE UP TO FOUR TORCH-SIZED LIGHTS WITHIN RANGE, MAKING THEM APPEAR AS TORCHES, LANTERNS, OR GLOWING ORBS THAT HOVER IN THE AIR FOR THE DURATION. YOU CAN ALSO COMBINE THE FOUR LIGHTS INTO ONE GLOWING VAGUELY HUMANOID FORM OF MEDIUM SIZE. WHICHEVER FORM YOU CHOOSE, EACH LIGHT SHEDS DIM LIGHT IN A 10-FOOT RADIUS.&AS A BONUS ACTION ON YOUR TURN, YOU CAN MOVE THE LIGHTS UP TO 60 FEET TO A NEW SPOT WITHIN RANGE. A LIGHT MUST BE WITHIN 20 FEET OF ANOTHER LIGHT CREATED BY THIS SPELL, AND A LIGHT WINKS OUT IF IT EXCEEDS THE SPELL’S RANGE.@",DAMAGE INFO,,,,,,,,,,,,,,,,SPELL CATEGORY,,,6,,,,,,,,,,,,,,,,,,,,,SAVING THROWS,,,,,,CLASS,1,1,0,0,0,0,1,0,1
DARKNESS,SPELL BASICS,,,,,,,,,,DAMAGE INFO,,,,,,,,,,,,,,,,SPELL CATEGORY,,,,,,,,,,,,,,,,,,,,,,,,SAVING THROWS,,,,,,CLASS,,,,,,,,,
DARKVISION,SPELL BASICS,,,,,,,,,,DAMAGE INFO,,,,,,,,,,,,,,,,SPELL CATEGORY,,,,,,,,,,,,,,,,,,,,,,,,SAVING THROWS,,,,,,CLASS,,,,,,,,,
DAYLIGHT,SPELL BASICS,,,,,,,,,,DAMAGE INFO,,,,,,,,,,,,,,,,SPELL CATEGORY,,,,,,,,,,,,,,,,,,,,,,,,SAVING THROWS,,,,,,CLASS,,,,,,,,,
DEATH WARD,SPELL BASICS,,,,,,,,,,DAMAGE INFO,,,,,,,,,,,,,,,,SPELL CATEGORY,,,,,,,,,,,,,,,,,,,,,,,,SAVING THROWS,,,,,,CLASS,,,,,,,,,
DELAYED BLAST FIREBALL,SPELL BASICS,,,,,,,,,,DAMAGE INFO,,,,,,,,,,,,,,,,SPELL CATEGORY,,,,,,,,,,,,,,,,,,,,,,,,SAVING THROWS,,,,,,CLASS,,,,,,,,,
DEMIPLANE,SPELL BASICS,,,,,,,,,,DAMAGE INFO,,,,,,,,,,,,,,,,SPELL CATEGORY,,,,,,,,,,,,,,,,,,,,,,,,SAVING THROWS,,,,,,CLASS,,,,,,,,,
DESTRUCTIVE WAVE,SPELL BASICS,,,,,,,,,,DAMAGE INFO,,,,,,,,,,,,,,,,SPELL CATEGORY,,,,,,,,,,,,,,,,,,,,,,,,SAVING THROWS,,,,,,CLASS,,,,,,,,,
DETECT EVIL AND GOOD,SPELL BASICS,1,DIVINATION,0,,V.S.@,SELF,1 ACTION,"CONCENTRATION, UP TO 10 MINUTE@","FOR THE DURATION, YOU KNOW IF THERE IS AN ABERRATION, CELESTIAL, ELEMENTAL, FEY, FIEND, OR UNDEAD WITHIN 30 FEET OF YOU, AS WELL AS WHERE THE CREATURE IS LOCATED. SIMILARLY, YOU KNOW IF THERE IS A PLACE OF OBJECT WITHIN 30 FEET OF YOU THAT HAS BEEN MAGICALLY CONSECRATED OR DESECRATED.&THE SPELL CAN PENETRATE MOST BARRIERS, BUT IT IS BLOCKED BY 1 FOOT OF STONE, 1 INCH OF COMMON METAL, A THIN SHEET OF LEAD, OR 3 FEET OF WOOD OR DIRT.@",DAMAGE INFO,,,,,,,,,,,,,,,,SPELL CATEGORY,,,6,,,,,,,,,,,,,,,,,,,,,SAVING THROWS,,,,,,CLASS,0,0,1,0,1,0,0,0,0
DETECT MAGIC,SPELL BASICS,1,DIVINATION,1,,V.S.@,SELF,1 ACTION,"CONCENTRATION, UP TO 10 MINUTE@","FOR THE DURATION, YOU SENSE THE PRESENCE OF MAGIC WITHIN 30 FEET OF YOU. IF YOU SENSE MAGIC IN THIS WAY, YOU CAN USE YOUR ACTION TO SEE A FAINT AURA AROUND ANY VISIBLE CREATURE OR OBJECT IN THE AREA THAT BEARS MAGIC, AND YOU LEARN ITS SCHOOL OF MAGIC, IF ANY.&THE SPELL CAN PENETRATE MOST BARRIERS, BUT IS BLOCKED BY 1 FOOT OF STONE, 1 INCH OF COMMON METAL, A THIN SHEET OF LEAD, OR 3 FEET OF WOOD OR DIRT.@",DAMAGE INFO,,,,,,,,,,,,,,,,SPELL CATEGORY,,,6,,,,,,,,,,,,,,,,,,,,,SAVING THROWS,,,,,,CLASS,1,1,1,1,1,1,1,0,1
DETECT POISON AND DISEASE,SPELL BASICS,1,DIVINATION,0,,V.S.M. (A YEW LEAF)@,SELF,1 ACTION,"CONCENTRATION, UP TO 10 MINUTE@","FOR THE DURATION, YOU CAN SENSE THE PRESENCE AND LOCATION OF POISONS, POISONOUS CREATURES, AND DISEASES WITHIN 30 FEET OF YOU. YOU ALSO IDENTIFY THE KIND OF POISON, POISONOUS CREATURE, OR DISEASE IN EACH CASE.&THE SPELL CAN PENETRATE MOST BARRIERS, BUT IS BLOCKED BY 1 FOOT OF STONE, 1 INCH OF COMMON METAL, A THIN SHEET OF LEAD, OR 3 FEET OF WOOD OR DIRT.@",DAMAGE INFO,,,,,,,,,,,,,,,,SPELL CATEGORY,,,6,,,,,,,,,,,,,,,,,,,,,SAVING THROWS,,,,,,CLASS,0,0,1,1,1,1,0,0,0
DETECT THOUGHTS,SPELL BASICS,,,,,,,,,,DAMAGE INFO,,,,,,,,,,,,,,,,SPELL CATEGORY,,,,,,,,,,,,,,,,,,,,,,,,SAVING THROWS,,,,,,CLASS,,,,,,,,,
*DIGITAL PHANTOM,SPELL BASICS,,,,,,,,,,DAMAGE INFO,,,,,,,,,,,,,,,,SPELL CATEGORY,,,,,,,,,,,,,,,,,,,,,,,,SAVING THROWS,,,,,,CLASS,,,,,,,,,
DIMENSION DOOR,SPELL BASICS,,,,,,,,,,DAMAGE INFO,,,,,,,,,,,,,,,,SPELL CATEGORY,,,,,,,,,,,,,,,,,,,,,,,,SAVING THROWS,,,,,,CLASS,,,,,,,,,
DISGUISE SELF,SPELL BASICS,1,ILLUSION,0,,V.S.@,SELF,1 ACTION,1 HOUR@,"YOU MAKE YOURSELF – INCLUDING YOUR CLOTHING, ARMOR, WEAPONS, AND OTHER BELONGINGS ON YOUR PERSON – LOOK DIFFERENT UNTIL THE SPELL ENDS OR UNTIL YOU USE YOUR ACTION TO DISMISS IT. YOU CAN SEEM 1 FOOT SHORTER OR TALLER AND CAN APPEAR THIN, FAT, OR IN BETWEEN. YOU CAN’T CHANGE YOUR BODY TYPE, SO YOU MUST ADOPT A FORM THAT HAS THE SAME BASIC ARRANGEMENT OF LIMBS. OTHERWISE, THE EXTENT OF THE ILLUSION IS UP TO YOU.&THE CHANGES WROUGHT BY THIS SPELL FAIL TO HOLD UP TO PHYSICAL INSPECTION. FOR EXAMPLE, IF YOU USE THIS SPELL TO ADD A HAT TO YOUR OUTFIT, OBJECTS PASS THROUGH THE HAT, AND ANYONE WHO TOUCHES IT WOULD FEEL NOTHING OR WOULD FEEL YOUR HEAD AND HAIR. IF YOU USE THIS SPELL TO APPEAR THINNER THAN YOU ARE, THE HAND OF SOMEONE WHO REACHES OUT TO TOUCH YOU WOULD BUMP INTO YOU WHILE IT WAS SEEMINGLY STILL IN MIDAIR. TO DISCERN THAT YOU ARE DISGUISED, A CREATURE CAN USE ITS ACTION TO INSPECT YOUR APPEARANCE AND MUST SUCCEED ON AN INTELLIGENCE (INVESTIGATION) CHECK AGAINST YOUR SPELL SAVE DC.@",DAMAGE INFO,,,,,,,,,,,,,,,,SPELL CATEGORY,,,6,,,,,,,,,,,,,,,,,,,,,SAVING THROWS,,,,,,CLASS,1,1,0,0,0,0,1,0,1
DISINTEGRATE,SPELL BASICS,,,,,,,,,,DAMAGE INFO,,,,,,,,,,,,,,,,SPELL CATEGORY,,,,,,,,,,,,,,,,,,,,,,,,SAVING THROWS,,,,,,CLASS,,,,,,,,,
DISPEL EVIL AND GOOD,SPELL BASICS,,,,,,,,,,DAMAGE INFO,,,,,,,,,,,,,,,,SPELL CATEGORY,,,,,,,,,,,,,,,,,,,,,,,,SAVING THROWS,,,,,,CLASS,,,,,,,,,
DISPEL MAGIC,SPELL BASICS,,,,,,,,,,DAMAGE INFO,,,,,,,,,,,,,,,,SPELL CATEGORY,,,,,,,,,,,,,,,,,,,,,,,,SAVING THROWS,,,,,,CLASS,,,,,,,,,
DISSONANT WHISPERS,SPELL BASICS,1,ENCHANTMENT,0,,V.@,60 FEET,1 ACTION,INSTANTANEOUS@,"YOU WHISPER A DISCORDANT MELODY THAT ONLY ONE CREATURE OF YOUR CHOICE WITHIN RANGE CAN HEAR, WRACKING IT WITH TERRIBLE PAIN. THE TARGET MUST MAKE A WISDOM SAVING THROW. ON A FAILED SAVE, IT TAKES 3D6 PSYCHIC DAMAGE AND MUST IMMEDIATELY USE ITS REACTION, IF AVAILABLE, TO MOVE AS FAR AS ITS SPEED ALLOWS AWAY FROM YOU. THE CREATURE DOESN’T MOVE INTO OBVIOUSLY DANGEROUS GROUND, SUCH AS A FIRE OR A PIT. ON A SUCCESSFUL SAVE, THE TARGET TAKES HALF AS MUCH DAMAGE AND DOESN’T HAVE TO MOVE AWAY. A DEAFENED CREATURE AUTOMATICALLY SUCCEEDS ON THE SAVE.&&AT HIGHER LEVELS. WHEN YOU CAST THIS SPELL USING A SPELL SLOT OF 2ND LEVEL OR HIGHER, THE DAMAGE INCREASES BY 1D6 FOR EACH SLOT LEVEL ABOVE 1ST.@",DAMAGE INFO,,,,,,,,,,,,,,,,SPELL CATEGORY,,,2,,,,,,,,,,,,,,,,,,,,,SAVING THROWS,,,,,,CLASS,0,1,0,0,0,0,0,0,0
DIVINATION,SPELL BASICS,,,,,,,,,,DAMAGE INFO,,,,,,,,,,,,,,,,SPELL CATEGORY,,,,,,,,,,,,,,,,,,,,,,,,SAVING THROWS,,,,,,CLASS,,,,,,,,,
DIVINE FAVOR,SPELL BASICS,1,EVOCATION,0,,V.S.@,Self,1 BONUS ACTION,"CONCENTRATION, UP TO 1 MINUTE@","YOUR PRAYER EMPOWERS YOU WITH DIVINE RADIANCE. UNTIL THE SPELL ENDS, YOUR WEAPON ATTACKS DEAL AN EXTRA 1D4 RADIANT DAMAGE ON A HIT.@",DAMAGE INFO,,,,,,,,,,,,,,,,SPELL CATEGORY,,,2,,,,,,,,,,,,,,,,,,,,,SAVING THROWS,,,,,,CLASS,0,0,0,0,1,0,0,0,0
