SPELL NAME,SPELL BASICS,SPELL LEVEL,SCHOOL,RITUAL,CONCENTRATION,COMPONENTS,RANGE,CAST TIME,DURATION,DESCRIPTION,DAMAGE INFO,DAMAGE SPELL ,MELEE SPELL ATTACK,RANGED SPELL ATTACK,ACID,COLD,BLUDGEONING,FIRE,FORCE,LIGHTNING,NECROTIC,PIERCING,POISON,RADIANT,SLASHING,THUNDER,SPELL CATEGORY,AOE,BANISHMENT,BUFF,CONDITIONS,COMMUNICATION,CONCEALMENT,DEBUFF,DEFENSIVE,DIVINATION,HEAL,ILLUSION,ILLUMINATION,MINIONS,MOBILITY,6TH SENSE,OFFENSIVE,OTHER,PLANAR,REALITY WARP,REVIVE/RESTORE,SCALES,TELEPORTATION,WARDING,SAVING THROWS,CHARISMA,CONSTITUTION,DEXTERITY,STRENGTH,WISDOM,CLASS,ARTIFICER,BARD,CLERIC,DRUID,PALADIN,RANGER,SORCERER,WARLOCK,WIZARD
*ABSORB ELEMENTS,SPELL BASICS,1,ABJURATION,0,,S.@,SELF,1 REACTION,1 ROUND@,"WHEN YOU TAKE ACID, COLD, FIRE, LIGHTNING, OR THUNDER DAMAGE YOU CAN CAST THIS SPELL AS A REACTION.&THE SPELL CAPTURES SOME OF THE INCOMING ENERGY, LESSENING ITS EFFECT ON YOU AND STORING IT FOR YOUR NEXT MELEE ATTACK. YOU HAVE RESISTANCE TO THE TRIGGERING DAMAGE TYPE UNTIL THE START OF YOUR NEXT TURN. ALSO, THE FIRST TIME YOU HIT WITH A MELEE ATTACK ON YOUR NEXT TURN, THE TARGET TAKES AN EXTRA 1D6 DAMAGE OF THE TRIGGERING TYPE, AND THE SPELL ENDS.&&AT HIGHER LEVELS. WHEN YOU CAST THIS SPELL USING A SPELL SLOT OF 2ND LEVEL OR HIGHER, THE EXTRA DAMAGE INCREASES BY 1D6 FOR EACH SLOT LEVEL ABOVE 1ST.@",DAMAGE INFO,,,0,1,1,0,1,0,1,0,0,0,0,,0,SPELL CATEGORY,0,,1,0,0,,0,1,0,0,0,0,0,,0,1,0,,0,0,1,0,,SAVING THROWS,,,,,,CLASS,0,0,0,1,0,1,0,0,1
ACID SPLASH,SPELL BASICS,0,CONJURATION,0,0,"V, S@",60 FEET,1 ACTION,INSTANTANEOUS@,"YOU HURL A BUBBLE OF ACID. CHOOSE ONE CREATURE WITHIN RANGE, OR CHOOSE TWO CREATURES WITHIN RANGE THAT ARE WITHIN 5 FEET OF EACH OTHER. A TARGET MUST SUCCEED ON A DEXTERITY SAVING THROW OR TAKE 1D6 DAMAGE.&&THIS SPELL'S DAMAGE INCREASES BY 1D6 WHEN YOU REACH 5TH LEVEL (2D6), 11TH LEVEL (3D6), AND 17TH LEVEL (4D6).@",DAMAGE INFO,0,0,0,1,0,0,0,0,0,0,0,0,0,0,0,SPELL CATEGORY,1,0,0,0,0,0,0,0,0,0,0,0,0,,0,1,0,0,0,0,1,0,0,SAVING THROWS,0,0,0,0,0,CLASS,,0,0,0,0,0,1,0,1
AID,SPELL BASICS,2,ABJURATION,0,0,"V, S, M, (A TINY STRIP OF WHITE CLOTH)@",30 FEET,1 ACTION,8 HOURS@,"YOUR SPELL BOLSTERS YOUR ALLIES WITH TOUGHNESS AND RESOLVE. CHOOSE UP TO THREE CREATURES WITHIN RANGE. EACH TARGET'S HIT POINTS MAXIMUM AND CURRENT HIT POINTS INCREASE BY 5 FOR THE DURATION.&&AT HIGHER LEVELS. WHEN YOU CAST THIS SPELL USING A SPELL SLOT OF 3RD LEVEL OR HIGHER, A TARGET'S HIT POINTS INCREASE BY AN ADDITIONAL 5 FOR EACH SLOT LEVEL ABOVE 2ND.@",DAMAGE INFO,0,0,0,0,0,0,0,0,0,0,0,0,0,0,0,SPELL CATEGORY,0,0,1,0,0,0,0,0,0,0,0,0,0,0,0,0,0,0,0,0,1,0,0,SAVING THROWS,0,0,0,0,0,CLASS,,,,,,,,,
ALARM,SPELL BASICS,1,ABJURATION,1,0,"V, S, M, (A TINY BELL AND A PIECE OF FINE SILVER WIRE)@",30 FEET,1 MINUTE@,8 HOURS@,"YOU SET AN ALARM AGAINST UNWANTED INTRUSION. CHOOSE A DOOR, A WINDOW, OR AN AREA WITHIN RANGE THAT IS NO LARGER THAN A 20-FOOT CUBE. UNTIL THE SPELL ENDS, AN ALARM ALERTS YOU WHENEVER A TINY OR LARGER CREATURE TOUCHES OR ENTERS THE WARDED AREA. WHEN YOU CAST THIS SPELL, YOU CAN DESIGNATE CREATURES THAT WON'T SET OFF THE ALARM. YOU ALSO CHOOSE WHETHER THE ALARM IS MENTAL OR AUDIBLE.&A MENTAL ALARM ALERTS YOU WITH A PING IN YOUR MIND IF YOU ARE WITHIN 1 MILE OF THE WARDED AREA. THIS PING AWAKENS YOU IF YOU ARE SLEEPING.&AN AUDIBLE ALARM PRODUCES THE SOUND OF A HAND BELL FOR 10 SECONDS WITHIN 60 FEET.@",DAMAGE INFO,0,0,0,0,0,0,0,0,0,0,0,0,0,0,0,SPELL CATEGORY,0,0,0,0,0,0,0,0,0,0,0,0,0,0,1,0,0,0,0,0,0,0,1,SAVING THROWS,0,0,0,0,0,CLASS,,,,,,,,,
ALTER SELF,SPELL BASICS,2,TRANSMUTATION,0,1,"V, S@",SELF,1 ACTION,"CONCENTRATION, UP TO 1 HOUR@","YOU ASSUME A DIFFERENT FORM. WHEN YOU CAST THIS SPELL, CHOOSE ONE OF THE FOLLOWING OPTIONS, THE EFFECTS OF WHICH LAST FOR THE DURATION OF THE SPELL. WHILE THE SPELL LASTS, YOU CAN END ONE OPTION AS AN ACTION TO GAIN THE BENEFITS OF A DIFFERENT ONE.&$AQUATIC ADAPTATION. YOU ADAPT YOUR BODY TO AN AQUATIC ENVIRONMENT, SPROUTING GILLS AND GROWING WEBBING BETWEEN YOUR FINGERS. YOU CAN BREATHE UNDERWATER AND GAIN A SWIMMING SPEED EQUAL TO YOUR WALKING SPEED.&$CHANGE APPEARANCE. YOU TRANSFORM YOUR APPEARANCE. YOU DECIDE WHAT YOU LOOK LIKE, INCLUDING YOUR HEIGHT, WEIGHT, FACIAL FEATURES, SOUND OF YOUR VOICE, HAIR LENGTH, COLORATION, AND DISTINGUISHING CHARACTERISTICS, IF ANY. YOU CAN MAKE YOURSELF APPEAR AS A MEMBER OF ANOTHER RACE, THOUGH NONE OF YOUR STATISTICS CHANGE. YOU ALSO CAN'T APPEAR AS A CREATURE OF A DIFFERENT SIZE THAN YOU, AND YOUR BASIC SHAPE STAYS THE SAME; IF YOU'RE BIPEDAL, YOU CAN'T USE THIS SPELL TO BECOME QUADRUPEDAL, FOR INSTANCE. AT ANY TIME FOR THE DURATION OF THE SPELL, YOU CAN USE YOUR ACTION TO CHANGE YOUR APPEARANCE IN THIS WAY AGAIN.&$NATURAL WEAPONS. YOU GROW CLAWS, FANGS, SPIINES, HORNS, OR A DIFFERENT NATURAL WEAPON OF YOUR CHOICE. YOUR UNARMED STRIKES DEAL 1D6 BLUDGEONING, PIERCING, OR SLASHING DAMAGE, AS APPROPRIATE TO THE NATURAL WEAPON YOU CHOSE, AND YOU ARE PROFICIENT WITH YOUR UNARMED STRIKES. FINALLY, THE NATURAL WEAPON IS MAGIC AND YOU HAVE A +1 BONUS TO THE ATTACK AND DAMAGE ROLLS YOU MAKE USING IT.@",DAMAGE INFO,1,0,0,0,0,1,0,0,0,0,1,0,0,1,0,SPELL CATEGORY,0,0,1,0,0,1,0,0,0,0,0,0,0,1,0,0,0,0,1,0,0,0,0,SAVING THROWS,0,0,0,0,0,CLASS,,,,,,,,,
ANIMAL FRIENDSHIP,SPELL BASICS,1,ENCHANTMENT,0,0,"V, S, M, (A MORSEL OF FOOD)@",30 FEET,1 ACTION,24 HOURS@,"THIS SPELL LETS YOU CONVINCE A BEAST THAT YOU MEAN IT NO HARM. CHOOSE A BEAST THAT YOU CAN SEE WITHIN RANGE. IT MUST SEE AND HEAR YOU. IF THE BEAST'S INTELLIGENCE IS 4 OR HIGHER, THE SPELL FAILS. OTHERWISE, THE BEAST MUST SUCCEED ON A WISDOM SAVING THROW OR BE CHARMED BY YOU FOR THE SPELLS DURATION. IF YOU OR ONE OF YOUR COMPANIONS HARMS THE TARGET, THE SPELLS END. &&AT HIGHER LEVELS. WHEN YOU CAST THIS SPELL, YOU CAN AFFECT ONE ADDITIONAL BEAST FOR EACH SLOT LEVEL ABOVE 1ST.@",DAMAGE INFO,0,0,0,0,0,0,0,0,0,0,0,0,0,0,0,SPELL CATEGORY,0,0,0,1,0,0,0,0,0,0,0,0,1,0,0,0,0,0,0,0,1,0,0,SAVING THROWS,0,0,0,0,1,CLASS,,,,,,,,,
ANIMAL MESSENGER,SPELL BASICS,2,ENCHANTMENT,1,0,"V, S, M, (A MORSEL OF FOOD)@",30 FEET,1 ACTION,24 HOURS@,"BY MEANS OF THIS SPELL, YOU USE AN ANIMAL TO DELIVER A MESSAGE. CHOOSE A TINY BEAST YOU CAN SEE WITHIN RANGE, SUCH AS A SQUIRREL, A BLUE JAY, OR A BAT. YOU SPECIFY A LOCATION, WHICH YOU MUST HAVE VISITED, AND A RECIPIENT WHO MATCHES A GENERAL DESCRIPTION, SUCH AS ""A MAN OR WOMAN DRESSED IN THE UNIFORM OF THE TOWN GUARD"" OR ""A RED-HAIRED DWARF WEARING A POINTED HAT."" YOU ALSO SPEAK A MESSAGE OF UP TO TWENTY-FIVE WORDS. THE TARGET BEAST TRAVELS FOR THE DURATION OF THE SPELL TOWARD THE SPECIFIED LOCATION, COVERING ABOUT 50 MILES PER 24 HOURS FOR A FLYING MESSENGER, OR 25 MILES FOR OTHER ANIMALS.&WHEN THE MESSENGER ARRIVES, IT DELIVERS YOUR MESSAGE TO THE CREATURE THAT YOU DESCRIBED, REPLICATING THE SOUND OF YOUR VOICE. THE MESSENGER SPEAKS ONLY TO A CREATURE MATCHING THE DESCRIPTION OF YOU GAVE. IF THE MESSENGER DOESN'T REACH ITS DESTINATION BEFORE THE SPELL ENDS, THE MESSAGE IS LOST, AND THE BEAST MAKES ITS WAY BACK TO WHERE YOU CAST THIS SPELL. &&AT HIGHER LEVELS. IF YOU CAST THIS SPELL USING A SPELL SLOT OF 3RD LEVEL OR HIGHER, THE DURATION OF THE SPELL INCREASES BY 48 HOURS FOR EACH SLOT LEVEL ABOVE 2ND. @",DAMAGE INFO,0,0,0,0,0,0,0,0,0,0,0,0,0,0,0,SPELL CATEGORY,0,0,0,0,1,0,0,0,0,0,0,0,0,0,0,0,0,0,0,0,1,0,0,SAVING THROWS,0,0,0,0,0,CLASS,,,,,,,,,
ANIMAL SHAPES,SPELL BASICS,8,TRANSMUTATION,0,1,"V, S@",30 FEET,1 ACTION,"CONCENTRATION, UP TO 24 HOURS@","YOUR MAGIC TURNS OTHERS INTO BEASTS. CHOOSE ANY NUMBER OF WILLING CREATURES THAT YOU CAN SEE WITHIN RANGE. YOU TRANSFORM EACH TARGET INTO THE FORM OF A LARGE OR SMALLER BEAST WITH A CHALLENGE RATING OF 4 OR LOWER. ON SUBSEQUENT TURNS, YOU CAN USE YOUR ACTION TO TRANSFORM AFFECTED CREATURES INTO NEW FORMS.&THE TRANSFORMATION LASTS FOR THE DURATION FOR EACH TARGET, OR UNTIL THE TARGET DROPS TO 0 HIT POINTS OR DIES. YOU CAN CHOOSE A DIFFERENT FORM FOR EACH TARGET. A TARGET'S GAME STATISTICS ARE REPLACED BY THE STATISTICS OF THE CHOSEN BEAST, THOUGH THE TARGET RETAINS ITS ALIGNMENT AND INTELLIGENCE, WISDOM, AND CHARISMA SCORES. THE TARGET ASSUMES THE HIT POINTS OF ITS NEW FORM, AND WHEN IT REVERTS TO ITS NORMAL FORM, IT RETURNS TO THE NUMBER OF HIT POINTS IT HAD BEFORE IT TRANSFORMED. IF IT REVERTS AS A RESULT OF DROPPING TO 0 HIT POINTS, ANY EXCESS DAMAGE CARRIES OVER TO ITS NORMAL FORM. AS LONG AS THE EXCESS DAMAGE DOESN'T REDUCE THE CREATURE'S NORMAL FORM TO 0 HIT POINTS, IT ISN'T KNOCKED UNCONSCIOUS. THE CREATURE IS LIMITED IN THE ACTIONS IT CAN PERFORM BY THE NATURE OF ITS NEW FORM, AND IT CAN'T SPEAK OR CAST SPELLS.&THE TARGET'S GEAR MELDS INTO THE NEW FORM. THE TARGET CANT ACTIVATE, WIELD, OR OTHERWISE BENEFIT FROM ANY OF ITS EQUIPMENT.@",DAMAGE INFO,0,0,0,0,0,1,0,0,0,0,1,0,0,1,0,SPELL CATEGORY,0,0,1,0,0,0,0,0,0,0,0,0,0,0,0,0,0,0,1,0,0,0,0,SAVING THROWS,0,0,0,0,0,CLASS,,,,,,,,,
ANIMATE DEAD,SPELL BASICS,3,NECROMANCY,0,0,"V, S, M, (A DROP OF BLOOD, A PIECE OF FLESH, AND PINCH OF BONE DUST)@",10 FEET,1 MINUTE@,INSTANTANEOUS@,"THIS SPELL CREATES AN UNDEAD SERVANT. CHOOSE A PILE OF BONES OR A CORPSE OF A MEDIUM OR SMALL HUMANOID WITHIN RANGE. YOUR SPELL IMBUES THE TARGET WITH A FOUL MIMICRY OF LIFE, RAISING IT AS AN UNDEAD CREATURE. THE TARGET BECOMES A SKELETON IF YOU CHOSE BONES OR A ZOMBIE IF YOU CHOSE  A CORPSE (THE DM HAS THE CREATURE'S GAME STATISTICS).&ON EACH OF YOUR TURNS, YOU CAN USE A BONUS ACTIONTO MENTALLY COMMAND ANY CREATURE YOU MADE WITH THIS SPELL IF THE CREATURE IS WITHIN 60 FEET OF YOU (IF YOU CONTROL MULTIPLE CREATURES, YOU CAN COMMAND ANY OR ALL OF THEM AT THE SAME TIME, ISSUING THE SAME COMMAND TO EACH ONE). YOU DECIDE WHAT ACTION THE CREATURE WILL TAKE AND WHERE IT WILL MOVE DURING ITS NEXT TURN, OR YOU CAN ISSUE A GENERAL COMMAND,, SUCH AS TO GUARD A PARTICULAR CHAMBER OR CORRIDOR. IF YOU ISSUE NO COMMANDS, THE CREATURE ONLY DEFENDS ITSELF AGAINST HOSTILE CREATURES. ONCE GIVEN AN ORER, THE CREATURE CONTINUES TO FOLLOW IT UNTIL ITS TASK IS COMPLETE.&THE CREATURE IS UNDER YOUR CONTROL FOR 24 HOURS, AFTER WHICH IT STOPS OBEYING ANY COMMAND YOU'VE GIVEN IT. TO MAINTAIN CONTROL OF THE CREATURE FOR ANOTHER 24 HOURS, YOU MUST CAST THIS SPELL ON THE CREATURE AGAIN BEFORE THE CURRENT 24-HOUR PERIOD ENDS. THIS USE OF THE SPELL REASSERTS YOUR CONTROL OVER UP TO FOUR CREATURES YOU HAVE ANIMATED WITH THIS SPELL, RATHER THAN ANIMATING A NEW ONE.&&AT HIGHER LEVELS. WHEN YOU CAST THIS SPELL USING A SPELL SLOT OF 4TH LEVEL OR HIGHER, YOU ANIMATE OR REASSERT CONTROL OVER TWO ADDITIONAL UNDEAD CREATURES FOR EACH SLOT LEVEL ABOVE 3RD. EACH OF THE CREATURES MUST COME FROM A DIFFERENT CORPSE OR PILE OF BONES.@",DAMAGE INFO,0,0,0,0,0,0,0,0,0,0,0,0,0,0,0,SPELL CATEGORY,0,0,0,0,0,0,0,0,0,0,0,0,1,0,0,0,0,0,0,0,1,0,0,SAVING THROWS,0,0,0,0,0,CLASS,,,,,,,,,
ANIMATE OBJECTS,SPELL BASICS,5,TRANSMUTATION,0,1,"V, S@",120 FEET,1 ACTION,"CONCENTRATION, UP TO 1 MINUTE@","OBJECTS COME TO LIFE AT YOUR COMMAND. CHOOSE UP TO TEN NONMAGICAL OBJECTS WITHIN RANGE THAT ARE NOT BEING WORN OR CARRIED. MEDIUM TARGETS COUNT AS TWO OBJECTS, LARGE TARGETS COUNT AS FOUR OBJECTS, HUGE TARGETS COUNT AS EIGHT OBJECTS. YOU CAN'T ANIMATE ANY OBJECT LARGER THAN HUGE. EACH TARGET ANIMATES AND BECOMES A CREATURE UNDER YOUR CONTROL UNTIL THE SPELL ENDS OR UNTIL REDUCED TO 0 HIT POINTS.&AS A BONUS ACTION, YOU CAN MENTALLY COMMAND ANY CREATURE YOU MADE WITH THIS SPELL IF THE CREATURE IS WITHIN 500 FEET OF YOU (IF YOU CONTROL MULTIPLE CREATURES, YOU CAN COMMAND ANY OR ALL OF THEM AT THE SAME TIME, ISSUING THE SAME COMMAND TO EACH ONE). YOU DECIDE WHAT ACTION THE CREATURE WILL TAKE AND WHERE IT WILL MOVE DURING ITS NEXT TURN, OR YOU CAN ISSUE A GENERAL COMMAND, SUCH AS TO GUARD A PARTICULAR CHAMBER OR CORRIDOR. IF YOU ISSUE NO COMMANDS, THE CREATURE ONLY DEFENDS ITSELF AGAINST HOSTILE CREATURES. ONCE GIVEN AN ORDER, THE CREATURE CONTINUES TO FOLLOW IT UNTIL ITS TASK IS COMPLETE.&&ANIMATED OBJECT STATISTICS&SIZE$HP AC ATTACK$$$STR DEX&TINY$20 18 +8 TO HIT, 1D4+4 DAMAGE$4   18&SMALL$25 16 +6 TO HIT, 1D8+2 DAMAGE$6$6   14&MEDIUM$40 13 +5 TO HIT, 2D6+1 DAMAGE$14 10&LARGE$50 10 +6 TO HIT, 2D10+2 DAMAGE$14 10&HUGE$80 10 +8 TO HIT, 2D12 +4 DAMAGE$18 6&&AN ANIMATED OBJECT IS A CONSTRUCT WITH AC, HIT POINTS, ATTACKS, STRENGTH, AND DEXTERITY DETERMINED BY ITS SIZE. ITS CONSTITUTION IS 10 AND ITS INTELLIGENCE AND WISDOM ARE 3, AND ITS CHARISMA IS 1. ITS SPEED IS 30 FEET, IF THE OBJECTS LACK LEGS OR OTHER APPENDAGES IT CAN USE FOR LOCOMOTION, IT INSTEAD HAS A FLYING SPEED OF 30 FEET AND CAN HOVER. IF THE OBJECT IS SECURELY ATTACHED TO A SURFACE OR LARGER OBJECT, SUCH AS A CHAIN BOLTED TO A WALL, ITS SPEED IS 0. IT HAS BLINDSIGHT WITH A RADIUS OF 30 FEET AND IS BLIND BEYOND THAT DISTANCE. WHEN THE ANIMATED OBJECT DROPS TO 0 HIT POINTS, IT REVERTS TO ITS ORIGINAL OBJECT FORM, AND ANY REMAINING DAMAGE CARRIES OVER TO ITS ORIGINAL OBJECT FORM.&IF YOU COMMAND AN OBJECT TO ATTACK, IT CAN MAKE A SINGLE MELEE ATTACK AGAINST A CREATURE WITHIN 5 FEET OF IT. IT MAKES A SLAM ATTACK WITH AN ATTACK BONUS AND BLUDGEONING DAMAGE DETERMINE BY ITS SIZE. THE DM MIGHT RULE THAT A SPECIFIC OBJECT INFLICTS SLASHING OR PIERCING DAMAGE BASED ON ITS FORM.&&AT HIGHER LEVELS: IF YOU CAST THIS SPELL USING A SPELL SLOT OF 6TH LEVEL OR HIGHER, YOU CAN ANIMATE TWO ADDITIONAL OBJECTS FOR EACH SLOT LEVEL ABOVE 5TH.@",DAMAGE INFO,1,0,0,0,0,1,0,0,0,0,1,0,0,1,0,SPELL CATEGORY,0,0,0,0,0,0,0,0,0,0,0,0,1,0,0,0,0,0,0,0,1,0,0,SAVING THROWS,0,0,0,0,0,CLASS,,,,,,,,,
ANTILIFE SHELL,SPELL BASICS,5,ABJURATION,0,1,"V, S@",SELF (10-FOOT RADIUS),1 ACTION,"CONCENTRATION, UP TO 1 HOUR@","A SHIMMERING BARRIER EXTENDS OUT FROM YOU IN A 10-FOOT RADIUS AND MOVES WITH YOU, REMAINING CENTERED ON YOU AND HEDGING OUT CREATURES OTHER THAN UNDEAD AND CONSTRUCTS. THE BARRIER LASTS FOR THE DURATION.&THE BARRIER PREVENTS AN AFFECTED CREATURE FROM PASSING OR REACHING THROUGH. AN AFFECTED CREATURE CAN CAST SPELLS OR MAKE ATTACKS WITH RANGED OR REACH WEAPONS THROUGH THE BARRIER.&IF YOU MOVE SO THAT AN AFFECTED CREATURE IS FORCED TO PASS THROUGH THE BARRIER, THE SPELL ENDS.@",DAMAGE INFO,0,0,0,0,0,0,0,0,0,0,0,0,0,0,0,SPELL CATEGORY,1,0,0,0,0,0,0,0,0,0,0,0,0,1,0,0,0,0,0,0,0,0,1,SAVING THROWS,0,0,0,0,0,CLASS,,,,,,,,,
ANTIMAGIC FIELD,SPELL BASICS,8,ABJURATION,0,1,"V, S, M, (A PINCH OF POWDERED IRON OR IRON FILINGS)@",SELF (10-FOOT RADIUS SPHERE)@,1 ACTION,"CONCENTRATION, UP TO 1 HOUR@","A 10-FOOT-RADIUS INVISIBLE SPHERE OF ANTIMAGIC SURROUNDS YOU. THIS AREA IS DIVORCED FROM THE MAGICAL ENERGY THAT SUFFUSES THE MULTIVERSE. WITHIN THE SPHERE, SPELLS CAN'T BE CAST, SUMMONED CREATURES DISAPPEAR, AND EVEN MAGIC ITEMS BECOME MUNDANE. UNTIL THE SPELL ENDS, THE SPHERE MOVES WITH YOU, CENTERED ON YOU.&SPELLS AND OTHER MAGICAL EFFECTS, EXCEPT THOSE CREATED BY AN ARTIFACT OR A DEITY, ARE SUPPRESSED IN THE SPHERE AND CAN'T PROTRUDE INTO IT. A SLOT EXPENDED TO CAST A SUPPRESSED SPELL IS CONSUMED. WHILE AN EFFECT IS SUPPRESSED, IT DOESN'T FUNCTION, BUT THE TIME IT SPENDS SUPPRESSED COUNTS AGAINST ITS DURATION.&TARGETED EFFECT. SPELLS AND OTHER MAGICAL EFFECTS, SUCH AS MAGIC MISSILE AND CHARM PERSON, THAT TARGET A CREATURE OR AN OBJECT IN THE SPHERE HAVE NO EFFECT ON THAT TARGET.&AREAS OF MAGIC. THE AREA OF ANOTHER SPELL OR MAGICAL EFFECT, SUCH AS FIREBALL, CAN'T EXTEND INTO THE SPHERE. IF THE SPHERE OVERLAPS AN AREA OF MAGIC, THE PART OF THE AREA THAT IS COVERED BY THE SPHERE IS SUPPRESSED. FOR EXAMPLE, THE FLAMES CREATED BY A WALL OF FIRE ARE SUPPRESSED WITHIN THE SPHERE, CREATING A GAP IN THE WALL IF THE OVERLAP IS LARGE ENOUGH.&SPELLS. ANY ACTIVE SPELL OR OTHER MAGICAL EFFECT ON A CREATURE OR AN OBJECT IN THE SPHERE IS SUPPRESSED WHILE THE CREATURE OR OBJECT IS IN IT.&MAGIC ITEMS. THE PROPERTIES AND POWERS OF MAGIC ITEMS ARE SUPPRESSED IN THE SPHERE. FOR EXAMPLE, A +1 LONG SWORD IN THE SPHERE FUNCTIONS AS A NONMAGICAL LONG SWORD.&A MAGIC WEAPON'S PROPERTIES AND POWERS ARE SUPPRESSED IF IT IS USED AGAINST A TARGET IN THE SPHERE OR WIELDED BY AN ATTACKER IN THE SPHERE. IF A MAGIC WEAPON OR PIECE OF MAGIC AMMUNITION FULLY LEAVES THE SPHERE (FOR EXAMPLE, IF YOU FIRE A MAGIC ARROW OR THROW A MAGIC SPEAR AT A TARGET OUTSIDE THE SPHERE), THE MAGIC OF THE ITEM CEASES TO BE SUPPRESSED AS SOON AS IT EXITS.&MAGICAL TRAVEL. TELEPORTATION AND PLANAR TRAVEL FAIL TO WORK IN THE SPHERE, WHETHER THE SPHERE IS THE DESTINATION OR THE DEPARTURE POINT FOR SUCH MAGICAL TRAVEL. A PORTAL TO ANOTHER LOCATION, WORLD, OR PLANE OF EXISTENCE, AS WELL AS AN OPENING TO AN EXTRADIMENSIONAL SPACE SUCH AS THAT CREATED BY THE ROPE TRICK SPELLS, TEMPORARILY CLOSES WHILE IN THE SPHERE.&CREATURES AND OBJECTS. A CREATURE OR OBJECT SUMMONED OR CREATED BY MAGIC TEMPORARILY WINKS OUT OF EXISTENCE IN THE SPHERE. SUCH A CREATURE INSTANTLY REAPPEARS ONCE THE SPACE THE CREATURE OCCUPIED IS NO LONGER WITHIN THE SPHERE.&DISPEL MAGIC. SPELLS AND MAGICAL EFFECTS SUCH AS DISPEL MAGIC HAVE NO EFFECT ON THE SPHERE. LIKEWISE, THE SPHERES CREATED BY DIFFERENT ANTIMAGIC FIELD SPELLS DON'T NULLIFY EACH OTHER.@",DAMAGE INFO,0,0,0,0,0,0,0,0,0,0,0,0,0,0,0,SPELL CATEGORY,1,0,0,0,0,0,1,1,0,0,0,0,0,0,0,0,0,0,0,0,0,0,1,SAVING THROWS,0,0,0,0,0,CLASS,,,,,,,,,
ANTIPATHY/SYMPATHY,SPELL BASICS,8,ENCHANTMENT,0,0,"V, S, M, (EITHER A LUMP OF ALUM SOAKED IN VINEGAR FOR THE ANTIPATHY EFFECT OR A DROP OF HONEY FOR THE SYMPATHY EFFECT)@",60 FEET,1 HOUR@,10 DAYS@,"THIS SPELL ATTRACTS OR REPELS CREATURES OF YOUR CHOICE. YOU TARGET SOMETHING WITHIN RANGE, EITHER A HUGE OR SMALLER OBJECT OR CREATURE OR AN AREA THAT IS NO LARGER THAN A 200-FOOT CUBE. THEN SPECIFY A KIND OF INTELLIGENT CREATURE, SUCH AS RED DRAGONS, GOBLINS, OR VAMPIRES. YOU INVEST THE TARGET WITH AN AURA THAT EITHER ATTRACTS OR REPELS THE SPECIFIED CREATURES FOR THE DURATION. CHOOSE ANTIPATHY OR SYMPATHY AS THE AURA'S EFFECT.&ANTIPATHY. THE ENCHANTMENT CAUSES CREATURES OF THE KIND YOU DESIGNATED TO FEEL AN INTENSE URGE TO LEAVE THE AREA AND AVOID THE TARGET. WHEN SUCH A CREATURE CAN SEE THE TARGET OR COMES WITHIN 60 FEET OF IT, THE CREATURE MUST SUCCEED ON A WISDOM SAVING THROW OR BECOME FRIGHTENED. THE CREATURE REMAINS FRIGHTENED WHILE IT CAN SEE THE TARGET OR IS WITHIN 60 FEET OF IT. WHILE FRIGHTENED BY THE TARGET, THE CREATURE MUST USE ITS MOVEMENT TO MOVE TO THE NEAREST SAFE SPOT FROM WHICH IT CAN'T SEE THE TARGET. IF THE CREATURE MOVES MORE THAN 60 FEET FROM THE TARGET AND CAN'T SEE IT, THE CREATURE IS NO LONGER FRIGHTENED, BUT THE CREATURE BECOMES FRIGHTENED AGAIN IF IT REGAINS SIGHT OF THE TARGET OR MOVES WITHIN 60 FEET OF IT.&SYMPATHY. THE ENCHANTMENT CAUSES THE SPECIFIED CREATURES TO FEEL AN INTENSE URGE TO APPROACH THE TARGET WHILE WITHIN 60 FEET OF IT OR ABLE TO SEE IT. WHEN SUCH A CREATURE CAN SEE THE TARGET OR COMES WITHIN 60 FEET OF IT, THE CREATURE MUST SUCCEED ON A WISDOM SAVING THROW OR USE ITS MOVEMENT ON EACH OF ITS TURNS TO ENTER THE AREA OR MOVE WITHIN REACH OF THE TARGET. WHEN THE CREATURE HAS DONE SO, IT CAN'T WILLINGLY MOVE AWAY FROM THE TARGET.&IF THE TARGET DAMAGES OR OTHERWISE HARMS AN AFFECTED CREATURE, THE AFFECTED CREATURE CAN MAKE A WISDOM SAVING THROW TO END THE EFFECT, AS DESCRIBED BELOW.&ENDING THE EFFECT. IF AN AFFECTED CREATURE ENDS ITS TURN WHILE NOT WITHIN 60 FEET OF THE TARGET OR ABLE TO SEE IT, THE CREATURE MAKES A WISDOM SAVING THROW. ON A SUCCESSFUL SAVE, THE CREATURE IS NO LONGER AFFECTED BY THE TARGET AND RECOGNIZES THE FEELING OF REPUGNANCE OR ATTRACTION AS MAGICAL. IN ADDITION, A CREATURE AFFECTED BY THE SPELL IS ALLOWED ANOTHER WISDOM SAVING THROW EVERY 24 HOURS WHILE THE SPELL PERSISTS.&A CREATURE THAT SUCCESSFULLY SAVES AGAINST THIS EFFECT IS IMMUNE TO IT FOR 1 MINUTE@, AFTER WHICH TIME IT CAN BE AFFECTED AGAIN.@",DAMAGE INFO,0,0,0,0,0,0,0,0,0,0,0,0,0,0,0,SPELL CATEGORY,1,0,0,1,0,0,0,0,0,0,0,0,0,0,0,0,0,0,0,0,0,0,1,SAVING THROWS,0,0,0,0,1,CLASS,,,,,,,,,
ARCANE EYE,SPELL BASICS,4,DIVINATION,0,1,"V, S, M, (A BIT OF BAT FUR)@",30 FEET,1 ACTION,"CONCENTRATION, UP TO 1 HOUR@","YOU CREATE AN INVISIBLE, MAGICAL EYE WITHIN RANGE THAT HOVERS IN THE AIR FOR THE DURATION.&YOU MENTALLY RECEIVE VISUAL INFORMATION FROM THE EYE, WHICH HAS NORMAL VISION AND DARKVISION OUT TO 30 FEET. THE EYE CAN LOOK IN EVERY DIRECTION.&AS AN ACTION, YOU CAN MOVE THE EYE UP TO 30 FEET IN ANY DIRECTION. THERE IS NO LIMIT TO HOW FAR AWAY FROM YOU THE EYE CAN MOVE, BUT IT CAN’T ENTER ANOTHER PLANE OF EXISTENCE. A SOLID BARRIER BLOCKS THE EYE’S MOVEMENT, BUT THE EYE CAN PASS THROUGH AN OPENING AS SMALL AS 1 INCH IN DIAMETER.@",DAMAGE INFO,0,0,0,0,0,0,0,0,0,0,0,0,0,0,0,SPELL CATEGORY,0,0,0,0,0,0,0,0,0,0,0,0,0,0,1,0,0,0,0,0,0,0,0,SAVING THROWS,0,0,0,0,0,CLASS,,,,,,,,,
ARCANE GATE,SPELL BASICS,6,CONJURATION,0,1,"V, S@",500 FEET,1 ACTION,"CONCENTRATION, UP TO 10 MINUTES@","YOU CREATE LINKED TELEPORTATION PORTALS THAT REMAIN OPEN FOR THE DURATION. CHOOSE TWO POINTS ON THE GROUND YOU CAN SEE, ONE POINT WITHIN 10 FEET OF YOU AND ONE POINT WITHIN 500 FEET OF YOU. A CIRCULAR PORTAL, 10 FEET IN DIAMETER, OPENS OVER EACH POINT. IF THE PORTAL WOULD OPEN IN THE SPACE OCCUPIED BY A CREATURE, THE SPELL FAILS, AND THE CASTING IS LOST.&THE PORTALS ARE TWO-DIMENSIONAL GLOWING RINGS FILLED WITH MIST, HOVERING INCHES FROM THE GROUND AND PERPENDICULAR TO IT AT THE POINTS YOU CHOOSE. A RING IS VISIBLE ONLY FROM ONE SIDE (YOUR CHOICE), WHICH IS THE SIDE THAT FUNCTIONS AS A PORTAL.&ANY CREATURE OR OBJECT ENTERING THE PORTAL EXITS FROM THE OTHER PORTAL AS IF THE TWO WERE ADJECENT TO EACH OTHER; PASSING THROUGH A PORTAL FROM THE NONPORTAL SIDE HAS NO EFFECT. THE MIST THAT FILLS EACH PORTAL IS OPAQUE AND BLOCKS VISION THROUGH IT. ON YOUR TURN, YOU CAN ROTATE THE RINGS AS A BONUS ACTION SO THAT THE ACTIVE SIDE FACES IN A DIFFERENT DIRECTION.@",DAMAGE INFO,0,0,0,0,0,0,0,0,0,0,0,0,0,0,0,SPELL CATEGORY,0,0,0,0,0,0,0,0,0,0,0,0,0,0,0,0,0,0,0,0,0,1,0,SAVING THROWS,0,0,0,0,0,CLASS,,,,,,,,,
*ARCANE HACKING,SPELL BASICS,2,TRANSMUTATION,0,,V.S.M. (HACKING TOOLS)@,SELF,1 ACTION,1 HOUR@ (CONCENTRATION),"YOU GAIN ADVANTAGE ON ALL INTELLIGENCE CHECKS USING HACKING TOOLS TO BREAK SOFTWARE ENCRYPTION OR ONLINE SECURITY WHEN USING A FOREIGN SYSTEM. THIS SPELL ALSO ALLOWS YOU TO BREAK 2ND-LEVEL AND LOWER PROTECTIVE SPELLS SUCH AS ARCANE LOCK OR GLYPH OF WARDING BY MAKING AN INTELLIGENCE CHECK USING HACKING TOOLS AGAINST THE SPELL SAVE DC OF THE SPELL'S CASTER.&&AT HIGHER LEVELS: WHEN YOU CAST THIS SPELL USING A SPELL SLOT OF 3RD LEVEL OR HIGHER, YOU CAN ATTEMPT TO COUNTERACT A SPELL SET TO SECURE THE FOREIGN SYSTEM IF THE SPELL'S LEVEL IS EQUAL TO OR LESS THAN THE LEVEL OF THE SPELL SLOT YOU USED.@",DAMAGE INFO,,0,0,0,0,0,0,0,0,0,0,0,0,0,0,SPELL CATEGORY,0,,1,0,0,,0,0,0,0,0,0,0,,0,0,0,,0,0,1,0,,SAVING THROWS,,,,,,CLASS,0,0,0,0,0,0,1,1,1
ARCANE LOCK,SPELL BASICS,2,ABJURATION,0,0,"V, S, M, (GOLD DUST WORTH AT LEAST 25GP)@",TOUCH,1 ACTION,UNTIL DISPELLED@,"YOU TOUCH A CLOSED DOOR, WINDOW, GATE, CHEST, OR OTHER ENTRYWAY, AND IT BECOMES LOCKED FOR THE DURATION. YOU AND THE CREATURES YOU DESIGNATE WHEN YOU CAST THIS SPELL CAN OPEN THE OBJECT NORMALLY. YOU CAN ALSO SET A PASSWORD THAT, WHEN SPOKEN WITHIN 5 FEET OF THE OBJECT, SUPPRESSES THIS SPELL FOR 1 MINUTE@. OTHERWISE, IT IS IMPASSABLE UNTIL IT IS BROKEN OR THE SPELL IS DISPELLED OR SUPPRESSED. CASTING KNOCK ON THE OBJECT SUPPRESSES ARCANE LOCK FOR 10 MINUTES.&WHILE AFFECTED BY THIS SPELL, THE OBJECT IS MORE DIFFICULT TO BREAK OR FORCE OPEN; THE DC TO BREAK IT OR PICK ANY LOCKS ON IT INCREASES BY 10.@",DAMAGE INFO,0,0,0,0,0,0,0,0,0,0,0,0,0,0,0,SPELL CATEGORY,0,0,0,0,0,0,0,0,0,0,0,0,0,0,0,0,0,0,0,0,0,0,1,SAVING THROWS,0,0,0,0,0,CLASS,,,,,,,,,
ARMOR OF AGATHYS,SPELL BASICS,1,ABJURATION,0,0,"V, S, M, (A CUP OF WATER)@",SELF,1 ACTION,1 HOUR@,"A PROTECTIVE MAGICAL FORCE SURROUNDS YOU, MANIFESTING AS A SPECTRAL FROST THAT COVERS YOU AND YOUR GEAR. YOU GAIN 5 TEMPORARY HIT POINTS FOR THE DURATION. IF A CREATURE HITS YOU WITH A MELEE ATTACK WHILE YOU HAVE THESE HIT POINTS, THE CREATURE TAKES 5 COLD DAMAGE.&&AT HIGHER LEVELS. WHEN YOU CAST THIS SPELL USING A SPELL SLOT OF 2ND LEVEL OR HIGHER, BOTH THE TEMPORARY HIT POINTS AND THE COLD DAMAGE INCREASE BY 5 FOR EACH SLOT LEVEL ABOVE 1ST.@",DAMAGE INFO,1,0,0,0,1,0,0,0,0,0,0,0,0,0,0,SPELL CATEGORY,0,0,1,0,0,0,0,0,0,0,0,0,0,0,0,0,0,0,0,0,0,0,0,SAVING THROWS,0,0,0,0,0,CLASS,,,,,,,,,
ARMS OF HADAR,SPELL BASICS,1,CONJURATION,0,0,"V, S@",Self (10-foot radius),1 ACTION,INSTANTANEOUS@,"YOU INVOKE THE POWER OF HADAR, THE DARK HUNGER. TENDRILS OF DARK ENERGY ERUPT FROM YOU AND BATTER ALL CREATURES WITHIN 10 FEET OF YOU. EACH CREATURE IN THAT AREA MUST MAKE A STRENGTH SAVING THROW. ON A FAILED SAVE, A TARGET TAKES 2D6 NECROTIC DAMAGE AND CAN'T TAKE REACTIONS UNTIL ITS NEXT TURN. ON A SUCCESSFUL SAVE, THE CREATURE TAKES HALF DAMAGE, BUT SUFFERS NO OTHER EFFECT.&&AT HIGHER LEVELS. WHEN YOU CAST THIS SPELL USING A SPELL SLOT OF 2ND LEVEL OR HIGHER, THE DAMAGE INCREASES BY 1D6 FOR EACH SLOT LEVEL ABOVE 1ST.@",DAMAGE INFO,1,0,0,0,0,0,0,0,0,1,0,0,0,0,0,SPELL CATEGORY,1,0,0,0,0,0,1,0,0,0,0,0,0,0,0,0,0,0,0,0,1,0,0,SAVING THROWS,0,0,0,1,0,CLASS,,,,,,,,,
